{"checkpoint_sha256":"c43ab6cdd71e53fe69bb73e5a6698dfcab894c9c9aa0c22d9874856a9721469a","class_names":["mobility","sitting","standing"],"class_schema_sha256":"e677cc243121dab43b6a06497b69bf4fc48124f4427ee95e87a8c9d17515da9c","evidence_status":"source_validation_calibration_target_sealed","fit_input":{"labels_sha256":"a7c83f23072f2d1b33aa5065a6a20a77949217f3f6837b83f42a5c337bb0f2cf","logits_sha256":"ab68ab885d797f7a5ef49faaf290474b909e89413786028abd48f0c700dc65eb","sample_count":143},"fit_partition":"source_validation","method":"scalar_temperature","nll_after":0.47278814176318845,"nll_before":0.6073053901590836,"record_kind":"source_temperature_calibrator","record_sha256":"c90fd334b92ac473db1b16d515fc941c3bf3d38cfae695acb9105bb396595aa5","schema_version":"1.0.0","split_manifest_sha256":"ccb6c3d1254c1464c48e412afb6f83e7942113299e853f89c77df1d6cfad131b","status":"frozen_source_validation","target_labels_or_performance_used":false,"target_subject_or_window_records_used":false,"temperature":0.3654370885339243,"training_configuration_sha256":"2f96a582f71fd8150ecc86e3cfb7ae873a79b51830464b027cdde231ee2772d3","validation_window_ids_sha256":"e9b181fed9ae9c9bf17350d051b78427b316b8c78a7dff806355b20aa6a7535a"}
