{"checkpoint_sha256":"35730143f7bac6cf6be5fbc81034847d62e75ee7323678a6a90e83c9a61f13c4","class_names":["mobility","sitting","standing"],"class_schema_sha256":"e677cc243121dab43b6a06497b69bf4fc48124f4427ee95e87a8c9d17515da9c","evidence_status":"source_validation_calibration_target_sealed","fit_input":{"labels_sha256":"a7c83f23072f2d1b33aa5065a6a20a77949217f3f6837b83f42a5c337bb0f2cf","logits_sha256":"910046b8d61744c3a2f0f3778461441ad711cab3ad1174a2cd1a8bbde9439cb6","sample_count":143},"fit_partition":"source_validation","method":"scalar_temperature","nll_after":0.8949245387048395,"nll_before":0.9230289906896846,"record_kind":"source_temperature_calibrator","record_sha256":"337a7e372844c501f4877a9e8e6fcef929ab95fc96c0c7f68c35fcb51bb0994f","schema_version":"1.0.0","split_manifest_sha256":"ccb6c3d1254c1464c48e412afb6f83e7942113299e853f89c77df1d6cfad131b","status":"frozen_source_validation","target_labels_or_performance_used":false,"target_subject_or_window_records_used":false,"temperature":1.4241197051872663,"training_configuration_sha256":"78919913d9ede33cad65ee3559f405408763cc27e61f65dfd0946f280e05ff79","validation_window_ids_sha256":"e9b181fed9ae9c9bf17350d051b78427b316b8c78a7dff806355b20aa6a7535a"}
