{"checkpoint_sha256":"647de1bbe803fc6a9028d02f78c2870ab8ba0e916743f67df633906d8c383c71","class_names":["mobility","sitting","standing"],"class_schema_sha256":"e677cc243121dab43b6a06497b69bf4fc48124f4427ee95e87a8c9d17515da9c","evidence_status":"source_validation_calibration_target_sealed","fit_input":{"labels_sha256":"a7c83f23072f2d1b33aa5065a6a20a77949217f3f6837b83f42a5c337bb0f2cf","logits_sha256":"62e758bb64ab31305c69a8c567bf2cca07d83f32f72a696bc24deac6a2248ef6","sample_count":143},"fit_partition":"source_validation","method":"scalar_temperature","nll_after":0.5173532962707672,"nll_before":0.5480402099304408,"record_kind":"source_temperature_calibrator","record_sha256":"7d603304989549f77a87d260fd45360457b4baedd4a2739d6d81e6985838887d","schema_version":"1.0.0","split_manifest_sha256":"ccb6c3d1254c1464c48e412afb6f83e7942113299e853f89c77df1d6cfad131b","status":"frozen_source_validation","target_labels_or_performance_used":false,"target_subject_or_window_records_used":false,"temperature":0.5814210593061685,"training_configuration_sha256":"1723885db78711882a4502343d41ce78a9dbe1e4f2a28d2b7cce3b7c0ae9a493","validation_window_ids_sha256":"e9b181fed9ae9c9bf17350d051b78427b316b8c78a7dff806355b20aa6a7535a"}
