{"checkpoint_sha256":"e4d5070539a844ca1f7a01e35173fed82f717e71c337a5c351dcf4b0c4159fa4","class_names":["mobility","sitting","standing"],"class_schema_sha256":"e677cc243121dab43b6a06497b69bf4fc48124f4427ee95e87a8c9d17515da9c","evidence_status":"source_validation_calibration_target_sealed","fit_input":{"labels_sha256":"a7c83f23072f2d1b33aa5065a6a20a77949217f3f6837b83f42a5c337bb0f2cf","logits_sha256":"129b1238f86248c27a1d24bc7eec76ecff14cfe0dbbcfd2ceb7a90bf9531b308","sample_count":143},"fit_partition":"source_validation","method":"scalar_temperature","nll_after":0.5026159636324017,"nll_before":0.5243084699539382,"record_kind":"source_temperature_calibrator","record_sha256":"7376f6a0db003249cb47bf135db133fd7eca801f6fbc0d91854ab28abaec6d12","schema_version":"1.0.0","split_manifest_sha256":"ccb6c3d1254c1464c48e412afb6f83e7942113299e853f89c77df1d6cfad131b","status":"frozen_source_validation","target_labels_or_performance_used":false,"target_subject_or_window_records_used":false,"temperature":0.6050466933655385,"training_configuration_sha256":"d02a22ea332c972a2491cf554b3ad35cc8280f90593b836765f4b05895920496","validation_window_ids_sha256":"e9b181fed9ae9c9bf17350d051b78427b316b8c78a7dff806355b20aa6a7535a"}
