{"checkpoint_sha256":"45588133897104547746eb4564b165a9527a271bce0a6abee314158a51225e7b","class_names":["mobility","sitting","standing"],"class_schema_sha256":"e677cc243121dab43b6a06497b69bf4fc48124f4427ee95e87a8c9d17515da9c","evidence_status":"source_validation_calibration_target_sealed","fit_input":{"labels_sha256":"a7c83f23072f2d1b33aa5065a6a20a77949217f3f6837b83f42a5c337bb0f2cf","logits_sha256":"b5a54c2bca6bcb98cb74b0783241e5d64fb5bdbe3a7b11af2f67b5931b0a3202","sample_count":143},"fit_partition":"source_validation","method":"scalar_temperature","nll_after":0.8127612576972624,"nll_before":0.8327562281646737,"record_kind":"source_temperature_calibrator","record_sha256":"40ddc519c935384775594b22f1ace1d5efc9e4722d446a6efd229547051b79b3","schema_version":"1.0.0","split_manifest_sha256":"ccb6c3d1254c1464c48e412afb6f83e7942113299e853f89c77df1d6cfad131b","status":"frozen_source_validation","target_labels_or_performance_used":false,"target_subject_or_window_records_used":false,"temperature":1.3899470003230372,"training_configuration_sha256":"a34842fd933f76283ab2b4820dc7542053cab8ad37c95d1cd39aea564eed0d08","validation_window_ids_sha256":"e9b181fed9ae9c9bf17350d051b78427b316b8c78a7dff806355b20aa6a7535a"}
