{"checkpoint_sha256":"da0bcff7869fc0e233606fec0acdc0832d2d47e2fc3e49fc13251c018c62de5e","class_names":["mobility","sitting","standing"],"class_schema_sha256":"e677cc243121dab43b6a06497b69bf4fc48124f4427ee95e87a8c9d17515da9c","evidence_status":"source_validation_calibration_target_sealed","fit_input":{"labels_sha256":"a7c83f23072f2d1b33aa5065a6a20a77949217f3f6837b83f42a5c337bb0f2cf","logits_sha256":"910046b8d61744c3a2f0f3778461441ad711cab3ad1174a2cd1a8bbde9439cb6","sample_count":143},"fit_partition":"source_validation","method":"scalar_temperature","nll_after":0.8949245387048395,"nll_before":0.9230289906896846,"record_kind":"source_temperature_calibrator","record_sha256":"1bb82505a89d7d8fb3f1f3922e35c87bd893e01e73149f26239522cf18676d0c","schema_version":"1.0.0","split_manifest_sha256":"ccb6c3d1254c1464c48e412afb6f83e7942113299e853f89c77df1d6cfad131b","status":"frozen_source_validation","target_labels_or_performance_used":false,"target_subject_or_window_records_used":false,"temperature":1.4241197051872663,"training_configuration_sha256":"173e3bd057ea08940354d91166525fb75d78e699952181d160a8d6844a655a21","validation_window_ids_sha256":"e9b181fed9ae9c9bf17350d051b78427b316b8c78a7dff806355b20aa6a7535a"}
