{"checkpoint_sha256":"9f15700d10c5dac5ce34cd38b297b30d77c7af5f2fee972f11ea877f60a9dea6","class_names":["mobility","sitting","standing"],"class_schema_sha256":"e677cc243121dab43b6a06497b69bf4fc48124f4427ee95e87a8c9d17515da9c","evidence_status":"source_validation_calibration_target_sealed","fit_input":{"labels_sha256":"a7c83f23072f2d1b33aa5065a6a20a77949217f3f6837b83f42a5c337bb0f2cf","logits_sha256":"c7c8bd1b00a205dd7212b0d08ddf1bc69869d13f54ea56007435ab271f080609","sample_count":143},"fit_partition":"source_validation","method":"scalar_temperature","nll_after":0.6649945520496084,"nll_before":0.6893480029913976,"record_kind":"source_temperature_calibrator","record_sha256":"77593b81e45689b7522acb7d07a06e901d69f35032ba8a63eae79b837e7b35a8","schema_version":"1.0.0","split_manifest_sha256":"ccb6c3d1254c1464c48e412afb6f83e7942113299e853f89c77df1d6cfad131b","status":"frozen_source_validation","target_labels_or_performance_used":false,"target_subject_or_window_records_used":false,"temperature":1.371154436668013,"training_configuration_sha256":"d69fcdbf2562004b435cb5ed94b7497b0cadc8659b47a392994d0f544319176a","validation_window_ids_sha256":"e9b181fed9ae9c9bf17350d051b78427b316b8c78a7dff806355b20aa6a7535a"}
