{"checkpoint_sha256":"216d5c4321654442b61fbdc4729ecd15bf082266ec085fc5b75e3b5949ec9af7","class_names":["mobility","sitting","standing"],"class_schema_sha256":"e677cc243121dab43b6a06497b69bf4fc48124f4427ee95e87a8c9d17515da9c","evidence_status":"source_validation_calibration_target_sealed","fit_input":{"labels_sha256":"a7c83f23072f2d1b33aa5065a6a20a77949217f3f6837b83f42a5c337bb0f2cf","logits_sha256":"0f7810f54b8a6d2ad3451928275b2cfe79691af7782df2bf000b1a668a8cfd0a","sample_count":143},"fit_partition":"source_validation","method":"scalar_temperature","nll_after":0.5240650393165216,"nll_before":0.5739412315281733,"record_kind":"source_temperature_calibrator","record_sha256":"0d63d9337984ce0ecfed9f4fcd99aa06d8a465bf8cf3fa4e9aa58f4ca1f1ebd1","schema_version":"1.0.0","split_manifest_sha256":"ccb6c3d1254c1464c48e412afb6f83e7942113299e853f89c77df1d6cfad131b","status":"frozen_source_validation","target_labels_or_performance_used":false,"target_subject_or_window_records_used":false,"temperature":0.4971210505637303,"training_configuration_sha256":"f816a1fac920d998786a1a871c96db83f2e8429ee599f0de6f7350c5819b944e","validation_window_ids_sha256":"e9b181fed9ae9c9bf17350d051b78427b316b8c78a7dff806355b20aa6a7535a"}
